{
  "$schema": "https://json-schema.org/draft/2020-12/schema",
  "$id": "https://house-technical-designer.local/schemas/network.schema.json",
  "title": "Technical network",
  "type": "object",
  "required": [
    "id",
    "discipline",
    "systemType",
    "nodes",
    "ports",
    "edges"
  ],
  "properties": {
    "id": {
      "type": "string"
    },
    "discipline": {
      "enum": [
        "WATER",
        "WASTEWATER",
        "VENTILATION",
        "HEATING",
        "ELECTRICAL",
        "RAINWATER",
        "OTHER"
      ]
    },
    "systemType": {
      "type": "string"
    },
    "nodes": {
      "type": "array",
      "items": {
        "type": "object",
        "required": [
          "id",
          "kind",
          "position"
        ],
        "properties": {
          "id": {
            "type": "string"
          },
          "kind": {
            "type": "string"
          },
          "position": {
            "$ref": "https://house-technical-designer.local/schemas/geometry.schema.json#/$defs/Point3D"
          },
          "hostObjectId": {
            "type": "string"
          },
          "spaceId": {
            "type": "string"
          },
          "equipmentId": {
            "type": "string"
          },
          "componentId": {
            "type": "string"
          },
          "properties": {
            "type": "object",
            "description": "Physical properties the node states about itself. Numbers must be finite; the application never writes a value nobody entered.",
            "additionalProperties": {
              "anyOf": [
                {
                  "type": "string"
                },
                {
                  "type": "number"
                },
                {
                  "type": "boolean"
                },
                {
                  "type": "null"
                }
              ]
            }
          },
          "levelId": {
            "type": "string"
          }
        },
        "additionalProperties": true
      }
    },
    "ports": {
      "type": "array",
      "items": {
        "type": "object",
        "required": [
          "id",
          "nodeId",
          "role",
          "direction"
        ],
        "properties": {
          "id": {
            "type": "string"
          },
          "nodeId": {
            "type": "string"
          },
          "portTypeId": {
            "type": "string"
          },
          "role": {
            "type": "string"
          },
          "direction": {
            "enum": [
              "IN",
              "OUT",
              "BIDIRECTIONAL"
            ]
          },
          "connectionType": {
            "type": "string"
          },
          "nominalSize": {
            "type": "number"
          }
        },
        "additionalProperties": true
      }
    },
    "edges": {
      "type": "array",
      "items": {
        "type": "object",
        "required": [
          "id",
          "fromPortId",
          "toPortId",
          "path",
          "kind"
        ],
        "properties": {
          "id": {
            "type": "string"
          },
          "fromPortId": {
            "type": "string"
          },
          "toPortId": {
            "type": "string"
          },
          "path": {
            "type": "array",
            "minItems": 2,
            "items": {
              "$ref": "https://house-technical-designer.local/schemas/geometry.schema.json#/$defs/Point3D"
            }
          },
          "kind": {
            "type": "string"
          },
          "catalogItemId": {
            "type": "string"
          },
          "productId": {
            "type": "string"
          },
          "productVersion": {
            "type": "string"
          },
          "properties": {
            "type": "object",
            "description": "Physical properties of the routed segment: bore, material, slope, conductor section.",
            "additionalProperties": {
              "anyOf": [
                {
                  "type": "string"
                },
                {
                  "type": "number"
                },
                {
                  "type": "boolean"
                },
                {
                  "type": "null"
                }
              ]
            }
          }
        },
        "additionalProperties": true
      }
    }
  },
  "additionalProperties": true
}
